idvhd,nro,grado,orden,codalumno,apellidosnombres,genero,observacion,arte,cta,comu,efis,etra,erel,fcc,hge,ingl,mate,pfrrhh,areasdesaprobadas,recomendacion
1A1,1,1A,1,12345678,"ALTAMIRANO ATAUCURI, JHON ELVIS",M,0,14,11,10,15,11,12,12,10,12,9,10,4,"Tutor MARCOS : Tienes 4 areas desaprobadas, debes esforzarte bastante para reivindicarte, tu tutor de aula se reunira con tu padre o apoderado para ayudarte a superar tus calificaciones"
2A6,2,2A,6,11111111,"OCTUBRE CARBAJAL, MARIA NATALI",F,REPITENTE,15,11,12,16,12,12,11,12,11,9,13,1,"Tutor JUAN : Tienes una area desaprobada, debes estudiar un poco mas y reforzar tus habitos de estudio"
3A14,3,3A,14,22222222,"AGUERRO CAMPOS, DAYSI LIZET",F,0,16,16,17,16,16,18,19,17,16,19,18,0,"Tutor MARIA : Invicto, felicitaciones por tu esfuerzo y dedicacion"
4A4,4,4A,4,33333333,"AGUILA AREQUIPA, OLGA ESTHER",F,REINGRESANTE,15,11,14,15,16,14,13,12,12,9,11,1,"Tutor JOSEPH : Tienes una area desaprobada, debes estudiar un poco mas y reforzar tus habitos de estudio"
5A9,5,5A,9,44444444,"CAMPOS TRUJILLO, SANDRA LIZETH",F,TRASLADADO,16,12,16,17,16,17,15,14,14,15,15,0,"Tutor VICTOR : Invicto, felicitaciones por tu esfuerzo y dedicacion"
